LIB00001,Introducción a C#,Charles Petzold,Microsoft Press,2022,Tecnología e Informática,6
LIB00002,Estructuras de Datos en Java,Mark Allen Weiss,Pearson,2019,Ciencias e Ingeniería,2
LIB00003,El Señor de los Anillos,J.R.R. Tolkien,Minotauro,2001,Literatura y Narrativa,4
LIB00004,Historia de El Salvador,Rodolfo Baron Castro,Ministerio de Educación,1996,Historia y Ciencias Sociales,1
LIB00005,Fundamentos de Administración,Stephen Robbins,Pearson,2018,Derecho y Economía,6
LIB00006,Cálculo Diferencial e Integral,James Stewart,Cengage Learning,2015,Ciencias e Ingeniería,0
